{
  "artifact_name": "ci-debt-intelligence-compiled-rules",
  "generated_at": "2026-07-03T00:00:00Z",
  "producer": "l9-ci-debt-intelligence",
  "rules": [
    {
      "id": "CI-IMPORT-001",
      "language": [
        "yaml"
      ],
      "message": "CI-IMPORT-001: GitHub Actions job is missing PYTHONPATH for workspace imports.",
      "negative_patterns": [
        "PYTHONPATH"
      ],
      "pattern_type": "regex",
      "patterns": [
        "^\\s{2}[A-Za-z0-9_-]+:\\s*$"
      ],
      "quick_fix": {
        "insert_after_pattern": "(runs-on:.*)",
        "insert_text": "    env:\\n      PYTHONPATH: ${{ github.workspace }}\\n",
        "label": "Add PYTHONPATH env var to this job"
      },
      "severity": "error",
      "source": "l9-ci-debt-intelligence/compiled-rules",
      "topology": "gha_workflow"
    },
    {
      "id": "CI-DEPS-001",
      "language": [
        "toml"
      ],
      "message": "CI-DEPS-001: pyproject.toml missing [project.dependencies] section. Declare runtime deps (e.g. pydantic>=2.0).",
      "negative_patterns": [
        "\\[project\\.dependencies\\]"
      ],
      "pattern_type": "regex",
      "patterns": [
        "\\[project\\]"
      ],
      "quick_fix": {
        "insert_after_pattern": "(\\[project\\])",
        "insert_text": "\\ndependencies = [\\n    \"pydantic>=2.0\",\\n]\\n",
        "label": "Add [project.dependencies] section"
      },
      "severity": "warning",
      "source": "l9-ci-debt-intelligence/compiled-rules",
      "topology": "python_deps"
    },
    {
      "id": "CI-DEPS-002",
      "language": [
        "yaml"
      ],
      "message": "CI-DEPS-002: aggregate or final-decision job is missing an install step before execution.",
      "negative_patterns": [
        "pip install",
        "uv sync",
        "npm ci",
        "npm install"
      ],
      "pattern_type": "regex",
      "patterns": [
        "(?i)(final.decision|aggregate)[\\s\\S]*?steps:"
      ],
      "quick_fix": {
        "insert_after_pattern": "(- uses: actions/checkout.*)",
        "insert_text": "      - name: Install deps\\n        run: pip install pyyaml jsonschema pydantic\\n",
        "label": "Add dependency install step"
      },
      "severity": "error",
      "source": "l9-ci-debt-intelligence/compiled-rules",
      "topology": "gha_workflow"
    },
    {
      "id": "API-DRIFT-001",
      "language": [
        "python"
      ],
      "message": "API-DRIFT-001: ReviewReport exists but lacks suggested_tests. Add the field at the producer boundary.",
      "negative_patterns": [
        "suggested_tests"
      ],
      "pattern_type": "regex",
      "patterns": [
        "class\\s+ReviewReport"
      ],
      "quick_fix": null,
      "severity": "error",
      "source": "l9-ci-debt-intelligence/compiled-rules",
      "topology": "api_drift"
    },
    {
      "id": "DOCTRINE",
      "language": [
        "python"
      ],
      "message": "DOCTRINE: PacketEnvelope is not the active transport type. Use TransportPacket or an explicit compatibility adapter.",
      "negative_patterns": [],
      "pattern_type": "regex",
      "patterns": [
        "PacketEnvelope"
      ],
      "quick_fix": null,
      "severity": "error",
      "source": "l9-ci-debt-intelligence/compiled-rules",
      "topology": "doctrine_violation"
    }
  ],
  "schema_version": "1.0",
  "source_run_id": "fixture",
  "source_sha": "fixture"
}
